[
    {
        "id": "test-123",
        "firstName": "Alice",
        "lastName": "Johnson",
        "email": "alice.johnson@example.com",
        "phoneNumber": "+1-202-555-0101",
        "company": "Acme Corp",
        "title": "Account Manager",
        "createdAt": "2024-01-05T10:15:00",
        "updatedAt": "2024-11-20T09:00:00"
    },
    {
        "id": "c-002",
        "firstName": "Bob",
        "lastName": "Smith",
        "email": "bob.smith@example.com",
        "phoneNumber": "+1-202-555-0102",
        "company": "Globex",
        "title": "Sales Director",
        "createdAt": "2024-02-10T08:30:00",
        "updatedAt": "2025-03-15T14:20:00"
    },
    {
        "id": "c-003",
        "firstName": "Carol",
        "lastName": "Davis",
        "email": "carol.davis@example.com",
        "phoneNumber": "+1-202-555-0103",
        "company": "Initech",
        "title": "Product Owner",
        "createdAt": "2024-03-12T13:45:00",
        "updatedAt": "2025-01-22T10:05:00"
    },
    {
        "id": "c-004",
        "firstName": "David",
        "lastName": "Lee",
        "email": "david.lee@example.com",
        "phoneNumber": "+1-202-555-0104",
        "company": "Hooli",
        "title": "Engineer",
        "createdAt": "2024-04-18T16:00:00",
        "updatedAt": "2025-05-02T08:10:00"
    },
    {
        "id": "c-005",
        "firstName": "Emma",
        "lastName": "Wilson",
        "email": "emma.wilson@example.com",
        "phoneNumber": "+1-202-555-0105",
        "company": "Soylent",
        "title": "Marketing Lead",
        "createdAt": "2024-05-25T11:25:00",
        "updatedAt": "2025-06-30T12:00:00"
    },
    {
        "id": "c-006",
        "firstName": "Frank",
        "lastName": "Miller",
        "email": "frank.miller@example.com",
        "phoneNumber": "+1-202-555-0106",
        "company": "Umbrella",
        "title": "Support Specialist",
        "createdAt": "2024-06-07T09:40:00",
        "updatedAt": "2025-02-18T17:30:00"
    },
    {
        "id": "c-007",
        "firstName": "Grace",
        "lastName": "Martinez",
        "email": "grace.martinez@example.com",
        "phoneNumber": "+1-202-555-0107",
        "company": "Stark Industries",
        "title": "Analyst",
        "createdAt": "2024-07-14T07:55:00",
        "updatedAt": "2025-04-12T18:45:00"
    },
    {
        "id": "c-008",
        "firstName": "Henry",
        "lastName": "Brown",
        "email": "henry.brown@example.com",
        "phoneNumber": "+1-202-555-0108",
        "company": "Wayne Enterprises",
        "title": "Consultant",
        "createdAt": "2024-08-20T15:10:00",
        "updatedAt": "2025-07-07T09:35:00"
    },
    {
        "id": "c-009",
        "firstName": "Ivy",
        "lastName": "Nguyen",
        "email": "ivy.nguyen@example.com",
        "phoneNumber": "+1-202-555-0109",
        "company": "Wonka",
        "title": "Designer",
        "createdAt": "2024-09-28T12:05:00",
        "updatedAt": "2025-08-01T13:15:00"
    },
    {
        "id": "c-010",
        "firstName": "Jack",
        "lastName": "Taylor",
        "email": "jack.taylor@example.com",
        "phoneNumber": "+1-202-555-0110",
        "company": "Pied Piper",
        "title": "CTO",
        "createdAt": "2024-10-30T19:20:00",
        "updatedAt": "2025-07-21T11:55:00"
    }
]